Name,Rating,Review
Susan K,4.0,"i loved that the film hinted back to old dracula movies, but the dracula was hard to understand at times.  otherwise, the acting was great and the cinematography was really cool.  i didn't know what to expect and i really liked the film. it could win awards."
Omarr M,4.0,"highy atmospheric, well acted, spectacle, that brings new life to a classic tale.  spectacular cinematography."
No Name,1.0,"the plot moves at an unbearably slow pace, and any scary or suspenseful moments are over almost as soon as they begin, leaving no time for real tension to build. the constant, abrupt scene changes make it hard to stay engaged, and the overall experience feels disjointed. while it has some iconic visuals, the lack of flow and weak pacing made it a chore to watch. i found myself struggling to stay awake. this one might only appeal to film history buffs."
No Name,3.0,"it looks great, has plenty of atmosphere and doesn't drag and i enjoyed simon mcburney and eileen dafoe's performances. but i thought orlok was ridiculously ott as a monster which meant i found him humourous rather than scary, and felt rather sorry for atj who was poor in a thankless and fairly pointless role."
Christopher G,5.0,"very well written, casted, and produced! enjoyed it"
No Name,4.0,gran manera de abordar un tema tan cliché como lo son los vampiros
Jacob,5.0,i liked the scary guy he was scary to me
No Name,4.0,"a reação de abrir um sorriso ao reconhecer referências de diretores que tu admiras influenciando o trabalho de outro dos grandes. a experiência com a versão de nosferatu de robert eggers é de sorver o fôlego. estão presentes elementos da estética gótica, desde a arquitetura da cidade e do castelo do vampiro, até a tez alva e o figurino da protagonista. mas, eggers compõe o seu nosferatu mais próximo a dimensão de horror, elemento manifesto na versão de 1922 de murnau, com referências a clássicos do terror como o exorcista de 1973. o diretor mantém muitas das características de sua filmografia no longa: a película escura que trabalha a luz a partir do destaque, o feixe luminoso que desenha não apenas uma silhueta à janela, mas um caminho inevitável à presença maligna que ali está; a composição cênica de navios ao mar revolto, também manifestos em o farol e o homem do norte; a trilha sonora que encaixa como uma luva, seja para acentuar a sensação de incômodo, seja para antever um jump scare (os quais são bem trabalhados e entram bem na narrativa). lilly rose deep está muito bem no papel de ellen. confesso que logo que vi o anúncio da versão de nosferatu do eggers imaginei que anya taylor joy ficaria com o papel, mas lilly conseguiu equilibrar abjeção, horror e desejo na construção psicológica de sua personagem. bill skarsgård para além do conde orlock, interpreta o puro mal e o assombro que provoca não é marcado apenas nos momentos em que o monstro aparece (aliás, belo trabalho de maquiagem), mas sua presença maligna é representada ainda que em sua ausência.  pelo incômodo, estética e intransponível assombro nessa versão, nosferatu do eggers conquistou meu coração. a comparação com o clássico do murnau é inevitável, mas precisa ser localizada no período histórico. murnau é expressionismo alemão, uma outra construção de plano. na contemporaneidade, a comparação é desproporcional."
No Name,3.0,"tries to be supremely sinister and tragic and doesn't quite manage it. lovely acting, nice scenery and tone but it doesn't come together. too many elements murk it up. borrows extensively from the gary oldman one. seems like it's going to be clever and a bit weird, but is just a big movie dressed up in gothic tones."
No Name,5.0,"a spectacularly well-made film that i wanted to see again right away after leaving the cinema because i was so distracted by the beauty of each and every shot, i find it difficult to recall the core content and any one particular part of the film.  this film could easily be edited as a silent movie as the soundtrack is also absolute perfection.  the acting has been criticized but i honestly believe there was a need for overacting due to the ambiance and as a further homage to the original film, no single actor stole the show as the star of this film is the film itself. incredible set design and costumes, i can almost guarantee that this film will win at least two oscars, maybe it'll end up with five or six."
PortRow,3.0,"very stylish and the acting is very good, if occasionally a little over the top. the dialogue that count orlok has is overly florid (its a choice to emphasize his being from another time but it bordered on reading silly (he speaks romanian with subtitles) and the direction tends to telegraph when you are going to be jump-scared—and almost all of the horror is the show build up to a jump-scare or occasionally some gore. im glad i saw it but doubt i will be watching it when its streaming or on tv."
Thomas E,5.0,"very good take on an often told story. the leads were all excellent with the exception of one who has given up acting to play himself, over and over again."
No Name,2.0,"filme ruim mas muito bem feito.  os primeiros 30 minutos prometem muito mas quanto mais o tempo passa, o filme se torna quase uma comédia.  apesar de ser lindo visualmente e dos atores entregarem muito, a história é sem pé nem cabeça e ao decorrer do filme você se questiona se está captando o sentido ou se de fato, não há nenhum.  além disso, o que mais me irritou foi a quantidade de momentos com conotação sexual sem necessidade. o filme, em algum momento, passa a ser uma série de abusos das mulheres protagonistas.  por fim, é um daqueles filmes pra assistir quando der ""na telha"" e quando sair no streaming. não vale a pena ir ao cinema por ele."
Roger L,5.0,great lighting in film.   good story.  very scary and icky parts   enjoyed it overall.    not a film for grandma   it would scare her lol
No Name,4.0,masterpiece of a remake and another modern classic of robert eggers.
karenAnn,4.0,liked bram stokers dracula better but this was good
No Name,4.0,nosferatu is haunting beautiful.it is a dark fantasy and gothic masterpiece but only for the niche audiences.
Matt F,1.0,"too long and not worth the time. if it was trying to do something better with the dracula story, i missed it. didnt like the old movie and i dont like this one."
No Name,1.0,"i really, really wanted to like this film. i love the original and everything to do with dracula, and i'm a huge fan of gothic cinema, but this movie was a huge disappointment for me. some of the acting was very nicely done, and i can appreciate the atmosphere and the cinematography. and in fact, the first 30 minutes had me believing that it was going to be a fantastic movie. however, the longer it went on, the more the plot got extremely murky. the audience in my theater laughed several times at points that were clearly not meant to be funny, and there were so many plot holes. i also found myself really confused and disheartened by what their thesis wanted to be. it seemed like they wanted to say something about sexual assault, but didn't have a clear point. the fact that she ""sacrifices herself"" at the end made me wonder if they knew what message they wanted to get across at all, or if they only wanted to show the bleakness of a woman being assaulted multiple times just for the sake of it. i would say that i would rewatch it to try to figure it out, but i don't think i could subject myself to that again. and not to mention the horrible mustache. he looked like waluigi. bad all around. its only saving grace was willem dafoe. without him and his performance, i might even call it unwatchable. i had to rewatch the 1930s dracula when i got home just to cleanse my pallet."
No Name,4.0,"el cine expresionista regreso en forma de ficha.  el regreso del joven maestro roberto eggers en su séptima pelicula dirigida reimaginando la película nosferatu una de las abanderadas adaptaciones del cine expresionista de los 20s. con una reimaginacion del mito de dracula en el cine. invita a el espectador a abrir la mente a el significado del mito del monstruo maldito, desde un punto esotérico/ oculitista. y de  la  mano de una fotográfica ambiental y un sonido que abraza la idea de llevar a lo más oscuro el mito del relato tétrico romántico de dracula de bram stoker. una película 🎥 para los amantes del cine que requiere reflexion y paciencia."
No Name,5.0,fantastic horror movie
No Name,5.0,"great film!!!!!!!! second best nosferatu, right after spongebob."
Erica,5.0,10/10 super freaky and loved the male cast 😛
Devon P,5.0,"amazing cinematography, directing, casting, locations, and costuming. note that although nasferatu is not a horror movie, it is still extremely visceral in style and not for the weak.   if you are into film and cinematography like myself, i highly recommend it. it deserves an academy award."
Deryk,5.0,superb acting. love that they stuck somewhat to the original movie!
No Name,3.0,lovely cinematography but i felt like it was unnecessarily grotesque sometimes.
VM,1.0,was really impressed with lily rose depp’s performance. the movie however was a disappointment.
Srikrishnan R,1.0,very very boring.  the first movie that i've actually ever walked out on
Justin,4.0,"having never seen the original silent movie, i didn’t know what to think going into this movie. the movie is basically a retelling of the novel “dracula” by bram stoker. for the most part the movie stays true to the source material, while changing a couple things to make it stand on its own. while not terrifying, it’s definitely grotesque & interesting enough to keep you glued to the screen. i appreciate that you don’t really see the main antagonist count orlok (the vampire). the actors did such a great job especially willem defoe who always shines in whatever role he plays. the one down side i would point out is sometimes the lore is a little hard to follow towards the end. one instance was how they explained how the vampire curse actually works. other than that this is a solid movie that would recommend seeing in theaters over waiting for it to hit streaming platforms."
Clecio L,2.0,not good pretentious
smith9298,3.5,"incredible cinematography, skarsgard was creepy but the character was more like a slow speaking old vamp.  other actors were good and the story was interesting, maybe worth watching at home though."
No Name,0.5,oh my lord this was the most boring movie i’ve ever seen in my life
Fieldy,5.0,"good movie overall, same vibe as nosferatu 1922"
Joshua,5.0,"love me some good gothic horror, and this one takes the cake for being one of the greatest horror movies of the decade."
No Name,1.0,"way too long. did not earn its genre. more gross than scary and none of the relationships had depth. it was super flat. i wanted to like this so bad but it lacked.  1 star for the cool sets, makeup/costumes & the cats."
Andre,5.0,"if you love gothic horror and can handle mature adult themes, this is an experience of a lifetime! an absolute masterpiece. i never thought i would see something more iconic than dracula (1931). this is hands down one of the best works in the history of cinema. a round of applause to everyone involved in making this movie."
Arielle,2.5,i gave it a higher rating because of its originality along with the beautiful filmography but for me it was a super slow burn through the whole film and lacked the horror and excitement i was craving. recommend to watch at least once.
No Name,3.0,"truthfully, it was beautiful in terms of cinematic achievement. the script was similar to that of the original, by that, i mean the scenes and what occurred since the original was silent film. with that being said, it was slow and a bit boring. it was in no means scary as they rave it to be. it was a tad bit creepy and possibly disturbing. the acting was phenomenal, especially bill as orlok. his transformation was unbelievable. lily did a wonderful job as well even though people are making fun of her “possessed” style of acting where it just looks as if she is gyrating in the style of a seizure. if you want to watch it, go in to it knowing it has the writing style of an old victorian style film. it can be boring to those that don’t appreciate this style."
No Name,1.0,the scariest thing about that movie was how bad it was. if i could rate it a zero i would. i could have gone my whole life without seeing that movie
Vicente,5.0,"great movie. very gothic. bit of a stretch bringing in all the good vs. evil ethos to a reasonable understanding, but i eventually got it. warning, it's a period piece so one has to bear with the old english dialog, but it add reality to it. highly recommend the movie."
Bagel,5.0,"great storyline, amazing acting, overall 10/10 experience"
No Name,1.5,"o filme tinha um potencial exuberante mas segundo a avaliação da minha equipe o filme se perde no meio do caminho se tornando entedioso e lento,fora as cenas nojentas entre o casal de vampiro e mulher linda,fiquei com dó da loirinha,nota dó."
Deborah F,4.0,great cinematography and haunting music. gory with some jump scares.  kept my attention. best movie ive seen in quite awhile.
No Name,1.5,disappointing. i didn't get to see the ending because i got bored and decided to leave the theather early. something about it made it seem like an old movie but not in a good way.
Date night movie watcher,1.0,"slow to start, cinematography was way too dark, story was just boring with holes that didn't make sense. it was really terrible. we would have walked out but we had dinner reservations we needed to wait for so we stayed to see if it got better. sadly, it didn't.  the only bright spot was willem dafoe who was kind of a comic relief which was off but slightly entertaining."
No Name,5.0,"indredible settings and sound design make for a truly unsettling, haunted experience."
No Name,1.0,not what i thought it would be. sound visuals and performance was good but there was something missing that turned this movie into one of the most boring movies i have watched in a while
Kim,5.0,it was great all around!  very suspenseful!
No Name,4.5,"robert eggers, tomo el cargo de un proyecto con mucha responsabilidad cinematográfica, de un proyecto clásico y de una adaptación de la novela ""dracula"". lo hizo muy bien y me quedo satisfecho con esta experiencia ""nosferatu""."
Ronnie C,2.5,stylish but too long and drawn out
Aaron,5.0,an absolute masterpiece!
Jonathan,5.0,brilliant adaptation of bram stokers classic. artistically filmed with stellar performances. one of the best movies all year. also i believe this to be skarsgards best performance.
No Name,5.0,just a great film all the way around. great acting and directing. classic story.
paul m,4.0,"great drama - not as scary or jump-scary as i thought it might be. a very good, dark, drama."
Zinnia G,2.5,i didnt care for all gore. some of the details were not necessary.
Jaz,0.5,"i did not like this movie at all, neither did my best friend, nor did the woman we met in the bathroom on the way out of the theatre - who said she was also disappointed by the movie. i got a very different idea of what this movie was going to be like before watching it, i thought it would be more of a dark romantic dry comedy with some gore. but it was literally disgusting and offensive to watch, i could not recommend it any less to anyone who has a common decency and nature. so disturbing. to some points, the acting was great (almost too great) and the way they actually filmed the movie was impressive and thoughtful within the scenes. the plotline and the execution of it left much to be desired. the costumes and dialogue was fantastic, but some of the only redeeming qualities of the film."
Christen J,1.0,"boring, had very little story line, one of us fell asleep"
Kelsey,1.0,horrible!!! i’d give it negative stars if i could!
Facebook U,2.5,movie fell flat. overacted and cheesy dialogue.
No Name,1.5,"i was looking forward to this and wanted to like it, but as i was watching i kept wondering when it would be done. there were parts that felt like a bad acid trip. the story felt disjointed. the scenery, sets, and costumes were lovely. it really did feel like a movie from the 1930s. the character of ellen was grating and unsympathetic. the movie as a whole was too long and all i felt was relief when it was finally over."
Sandee,2.0,"movie was to long, to many story lines and nosferatu was hard to understand at times. his actual storyline was confusing until the end and the best part was the last scene of the movie."
Maeghan,1.0,worst piece of hot garbage ive ever watched
No Name,2.5,"the new release of nosferatu seems a bit dark.  i was looking forward to watching this new release, but,  i prefer the 1979  movie, nosferatu the vampyre directed by werner herzog"
No Name,4.5,"this film was amazing to watch, i really don't knew it would be so fantastic, bill skarsgård did an amazing role as count orlok, i definitely could see this film once more."
No Name,2.0,"i really enjoyed the cinematography and the historical setting, but the storyline was too slow and boring for me."
Emily B,3.0,"it's beautifully filmed with lots of stark imagery. unfortunately,  it felt muddled through the middle with some really slow parts."
Rhonda K,3.0,"picture was too dark, couldn’t see what was happening half the time."
No Name,0.5,felt about as scary as a 1920s horror movie with stupid shadows moving across the screen. also unnecessarily grotesque. we left the theater wishing we could have that time back.
No Name,0.5,"the theming and set time and place is beautiful and takes your breath away. sadly, while there were such well accomplished names in this movie, it was a let down. too much unneeded nude scenes, that did not contribute to the point of the scene, but to shock the viewer. storyline, was slow in developing, and even though there were moments that lit up the movie, they were quickly diminished but the slow plot. dafoe did lighten up the movie at multiple points, but there is just soo much he could do. the thing that did annoy me, was the scandinavian accent of count orlok, no wonder though, but still, it felt out of place, even if it was haunting to hear."
No Name,3.5,"this movie is all about atmospheric vibes, which i loved. story was slow and methodical, but i was interested throughout. ending felt a little abrupt."
No Name,4.5,"me tomó mucho tiempo, tal vez desde the lighthouse, poder decir que una película de terror es la mejor experiencia del año. nosferatu de robert eggers es más de lo que esperé y de lo que podría esperar del nuevo maestro del cine de terror. definitivamente, si bien no es perfecta, se acerca a lo mejor de su género."
Zoli,3.0,"the acting was largely stilted , the dailogue who-so.  i enjoyed the cinematography."
No Name,5.0,"visually compelling, outstanding score and very good acting!"
No Name,5.0,"this is easily one of my top 3 favorite movies of all time. i had seen it twice in theaters so far and just can't get over how amazing the scene transitions, acting and just general vibe of the movie. amazing."
No Name,1.0,would not recommended! i love vampire films but the voice was doing way too much. i found it very distracting and couldn’t take the film seriously at all because of it. the cinematography was very good but that’s about it tbh….  had so much potential. did not meet it
No Name,1.5,"the visuals are great, and the actors’ talent speak for itself, however the plot of the story ruins the whole experience. putting aside the flaws in the storyline, if one wanted to write about this horror movie in a magazine, the title for it would be - nosferatu, lustful vampire rages in germany."
No Name,3.0,same old storyline and hammy. a few jump scares
Ann O,0.5,"horrible, horrible horrible"
Pimpollo,5.0,"great sound, visuals, performances, costumes. mostly empty theater."
customer,0.5,"i thought the movie was boring, too loud with the music, and too much nudity and too mucg graphic sex scenes in it. wasn't what i thought it was going to be."
Joe,3.0,the setting for the movie was amazing but there was something missing about it. all the actors had great performances but the substance of the plot had a lot to be desired. bram stoker's dracula 1993 2.0.
Devante,0.5,dreadfully lack luster storyline! i had never walked out on a movie before walking out of this one.
No Name,1.0,"this flick was so boring we walked out before it was over. repetitive, unnecessarily gross, seemed to lean on special effects. dull, don't bother."
Dave,4.0,"enjoyed the classic horror and suspense.  it was not gory, but the effects and makeup were astounding.  the wardrobe was beautifully done and i normally don't care about that.  the actors were uterly convincing.  i would have rated it higher but in a nearly empty cinema a guy came in late fell asleep and snored.  had to wake him up several times."
No Name,4.5,"compared to the 1922 and 1979 versions, eggers' version of nosferatu is scarier and sexier. arguably the best portrayal of nosferatu as an undead beast, filled with beautiful yet grim shots that linger throughout the entire film."
Joshua L,4.0,"thought provoking film making . i have it 4 stars as its not a film i can invite everyone to see necessarily . i love how gothic and dark the mood is . the primal /sexual tension and expression of emotions is powerful in this film . i neve watched the original nosferatu , so i was pleased with this films take on the vampires strengths and weaknesses ."
Kristopher F,0.5,"awful! so, so boring!"
Shandi  C,5.0,"a beautiful slow burn, dread from beginning to end."
No Name,1.0,"sorry, i simply cannot comprehend all the positive reviews and a tomato rating of 85%?!!!  try to imagine a film worse than nosferatu.  spoiler alert:  you can’t!  this is one of the most poorly written, cliche-laden films i have ever seen. it also features several hilarious way over the top performances where actors appear to fake eye rolling seizures *so*ludicrously hammy that people in the audience erupted in laughter several times  (one person even threw paper at the screen!).  the dialogue seems like it was written by 9th - 11th graders with gems like ""a force worse than evil!"" ""you're a villain"" and tons of manic, panicked characters running around literally jumping ""to and fro"" yelling ""he's coming! he's coming!""  truly one of the slowest-moving, most dull plodding films i have ever seen. one can't help but feel bad for the actors.   this film adds nothing new to the canon (other than a vampire that looks vaguely like a carpathian version of “frank zappa”.)  save your money and see any one of the countless better versions of this same story, which most adults have probably already seen at least 7 times. oh...and it just kind of ""ends""! (not that you’re even paying attention at the end, but just sayin')  you’ll laugh out loud, but sadly, this is not a comedy."
No Name,4.0,"it's a classic horror film set in the 18th century.   hats off to robert eggers and the crew; they did a marvellous job with the production.   while the film runs for a little over two hours, which is quite long, a 1 hour 30 minute film would have been more enjoyable.  i highly recommend horror fans watch it on the big screen."
No Name,5.0,"this was almost or is a masterpiece. the acting, lighting everything was done soooo well! minus the time traveling/instant transmission i habe no complaints. i wanna watch this again to relive the amazing acting! this is a must watch!"
No Name,5.0,"the type of movie you enjoy if you appreciate victorian era horror, detailed research of historical accuracy, theatrical acting, and thematic horror rather than jump scares. a wonderful adaptation of the classic vampire story taking the creature back to its folklore roots. robert eggers creates yet another horror masterpiece. if you write a review about bram stokers dracula from francis ford coppola being better than this while citing bad acting as the reason, you need to rewatch and pay closer attention to keanu reeves. every performance in this movie is better than his performance in that movie and i’m a reeves fan!"
Brandon E,4.0,"despite a long runtime and some pacing issues, nosferatu is a rich, rewarding horror movie that honors the original film and builds upon that foundation. as expected, eggers builds an immersive experience for us, and i was impressed by the set design, costume design, and atmosphere throughout the movie. the cast was wonderful and there are some genuinely horrifying moments that were jarring and sudden which was an aspect i really loved about the witch. skarsgård and dafoe were both brilliant. recommended"
Brian L,1.0,"the storyline was slow, plodding , and poor.  i thought for the level of actors that they had the acting was actually very deliberate, unimaginative, and inadequate. this is the first movie in over decades of movie watching that i have ever walked out on."
