Name,Rating,Review
No Name,2.0,"as soon as i found out about the release of this film, i was expecting something better. overall, the film is not bad, but i would not recommend watching it and would rather recommend the 1922 film. what i didn't like:  1. there are a lot of sex scenes and naked bodies, which in general are not needed for this film, i can only single out the scene at the end as a “ritual”, but basically this is not needed for the film.2. not really a minus, but something that i personally don’t like, it’s like i watched a big theater show, there’s no feeling of being in a movie, the actors played well, but it’s a theater and not a movie3. there are scenes that are worse than in the 1922 film. perhaps you may consider me wrong in terms of the fact that i compare the original film and this one, but it’s worth looking at it from the other side, why do i think the 1922 film is better? it's worth thinking about. i won't say specific scenes because it will be too long, but they are there.  finally, i want to say that this film upset me, i wanted to watch a terrifying film that conveys the spirit of nosferatu, but i watched something else, it could have been better."
No Name,3.0,"the visuals and acting were great, but the plot was so similar to dracula without being dracula it made it feel predictable, and you didn't really feel like these characters were real people save for the one guy you're apparently supposed to dislike, because the story doesn't flesh them out beyond their architype"
MICHAEL H,1.0,overacting.  sex scenes were unnecessary and in bad taste.  i had hoped for a classic horror story.  instead of scary it was laughable.  a great cast and  filmed well but poorly executed.  what a shame.
No Name,1.5,the only thing worse than the story was the atrocious acting! giving it one star for the sheer comedic painfulness.
Bill,4.0,"great movie, slow at times."
No Name,1.0,overhyped - what a wast of time. it looks amazing but that’s it.  confused screenwriting and wooden dialogue performed by constantly trembling actors.
No Name,1.0,cinematography and costumes were great but it’s one of the worst movies i’ve ever seen. sloppy and meandering.
Ron,2.5,"overall a cool vampire story following the footsteps of the original but it was a bit boring, slow and corny at times. the voice of count orloc was distracting and hard to understand at times."
No Name,1.0,"slow and very boring. upset i watched the whole film and didn't leave halfway through  cinematography and acting by some of the main cast was good, but not enough to make this a worthwhile watch."
Thomas,2.0,decent remake of the old silent movie. might be worth waiting to watch it on tv.
No Name,0.5,the movie was boring
No Name,4.0,"classic horror film. period piece. great sets, acting, and special effects.   a bit long, over 2 hours. could have pulled out 15 to 30 minutes and not missed a beat.  that being said i really enjoyed the movie, and interesting mix of an old classic with modern gore. nosferatu may have raised the bar on dracula movies to a new height.  a must see for horror fans."
No Name,1.5,didn’t live up to expectations.  too many disjointed parts. the beast was a nasty piece. needed more than just a nasty beast though. the heroine was very good. very disappointing.
mindy d,3.5,great movie!!!!just kinda long
No Name,2.0,"was one of the few movies i felt like leaving the cinema   1st hour was so slow, everything happened in the last 30 minutes   was nothing that we’ve not seen before when lee played dracula"
ammar S,5.0,very eeri feel to this film with some phenomenal acting as well as cinematography.
No Name,2.0,"excellent cinematography and solid performances from most of the actors. unfortunately not an original take on an old tale and there was a lack of depth to the whole thing,. i think i would have enjoyed it nore if it were less long, but an hour in i found myself bored and looking at my watch."
Ryan Garrison,2.0,way too long. and is missing the best parts of the bram stokers novel.
No Name,3.5,"the visuals were stunning. the sound effects kept you at the edge of your seat. orlock's breathing, the way he spoke, the poetic dialogue set the mood perfectly.  the ending however wasn't my favorite. just because i don't find it believable that orlock could be so dumb after having been a vampire so long."
Montie B,2.0,very few redeeming qualities other than the cast was great but the movie failed to live up to bram stokers dracula although it most likely was never intended to.  it loosely follows bram stokers dracula and once you watch it about the only thing you come away with is understanding why the original was banned for copyright infringement.  the story was similar but the names were changed to protect those guilty of a bad knockoff.
Wyatt,4.0,"amazing cinematography and shots, a great story, loved how the characters spoke like they were in the 1800s. loved the sets, nosferatu was great, dafoe was great, superb acting all around. leaves a little to be desired but still is overall a breath of fresh air and terrific"
No Name,5.0,"an instant classic. disturbing, scary, intriguing and a pure cinema experience! bravo!"
Lalo Preciado,4.0,it was ok. could use more explanation
teri,4.5,i know the way it was shot. in the storyline was the same but better and it kept you feeling like you were at a vampire movie. well done.
Steven G,1.0,very confusing movie. i didn’t know what was going on in the movie.
No Name,1.5,the first 45mins of the movie had me invested. lily depps 70th seizure had me check out early. anticlimactic ending and super awkward and forced sex scenes. the entire theatre giggled everytime ellen started convulsing. wait for it to hit netflix dont waste your money.
No Name,0.5,the film is a bad remake of dracula. if u know the drac story: u will see it here again. they only changed the names of the characters: but it's the exact same drac story step by tedious step.   i was planning on walking out before the middle of the movie: but i was invited...would have been rude.   i can't recommend it to no one knowing it's a knockoff of the original story.  the original 1922 film was really scary.   but this one: 5 thumbs down 👎
Lucas,5.0,"a very rare case nowadays where a movie genuinely gave me tingles for its eerie settings, vibe, and shots. also a very well acted and even vocal performances mainly by lilly-rose, nicholas, and bill."
Rhonda S,5.0,"this was a great movie! i loved the way it was filmed, the atmosphere and everything about it.  the music was also perfectly balanced to the mood of the movie."
No Name,5.0,"a lot of people might not like this movie because they are used to comic book movies with a lot of action and little thinking. but nosferatu is an amazing film that made me think for a few days about how well the film was shot, the great plot and acting. nosferatu's voice is legendary. i am going to see it again this week."
Galilea,4.0,acting was great but predictable.
No Name,5.0,masterfully shot and stays true to the spirit of the source material that inspired it. i have seen some complaints that it is slow. but in truth this is not meant to be an edge of your seat horror thriller but in many ways it is more a gothic romance with horror elements. the pacing while probably somewhat jarring to some modern audiences is well within the theme of the original film and honors it while also adding its own unique elements. i expect this films stature to rise in the coming years.
babyness L,5.0,excellent! lily’s performance was amazing along with the rest of the cast. loved the ending but sad.
Josh,4.0,a little bland- but a true rendition of stolker’s original sorrow
No Name,5.0,"i'm always drawn to period pieces, knew it would be great from the trailers, and it didn't disappoint. very intense and scary but excellent all around. haven't seen the original since a cinema college course decades ago, will definitely have to re-watch that version too."
Max Bryant,3.0,"great looking visuals and each cast member was very good.. the movie was okay bordering good in many parts. the story was slow in spots and had several moments of me questioning how ""that"" could possibly of  happened.. if you are a fan of the original and even lugosi's dracula you should see it. then make your.own comparisons and opinions."
Patricia,5.0,id like movies to be physically lighter.  the dark makes it hard to aee
MotoRacer,4.0,this is one of those rare movies that doesn't quite fit into its genre.  it's not a horror movie...  it's a horror experience. not slasher scares but truly unsettling and unnerving.  hard to recommend but it is delightfully dreadful.
Jared D,4.5,the movie starts off slow but once it picks up it stays interesting. some scenes were just the right level of disturbing i needed to see. the acting was great too. it was well worth it to watch.
Lestat de Lioncourt,5.0,captures dracula exactly as he was envisioned!!!
Jorge A,0.5,i will never get 2hrs of my life back.
No Name,2.5,"com base no que eu vi ao decorrer do filme que eles não conseguiram o suficiente para o terror da qual esse vampiro expressa no filme de 1928, mas concordo que foi elaborado e deu ar de esperança para o terror gótico, não é ruim, mas deveria ser melhor com tamanho orçamento"
No Name,1.0,like a box of rocks.dumb!!!
No Name,2.5,went to the bathroom towards the end and did go back.
Chris,3.0,"very cinematic, but kind of slow."
brian g,2.0,"the story as ok, dialogue was troublesome, but the cinematic elements were beautiful"
Tim Reichard,0.5,"not really scary. nosferatu, the monster was goofy looking with a big mustache.  kind of made the whole thing look silly."
No Name,3.0,"convulsing, eye rolling, rats… the pinnacle of originality"
Jeff L,3.0,"not half a scary as the original. too long and needed better editing.  movie never draws you in. some of the scenes needed better direction. not terrible, not great."
Eric,4.0,"the movies was great , could had a little bit more of action but the acting was on point."
Lolani F,4.5,"very much enjoyed it.  yes, it is a “slow” start, but it made sense to me. the first act sets up just what count olag/nosferatu is capable of, and i felt a slowly growing sense of dread and intensity the whole film through. will definitely watch again once it’s out on disc."
No Name,2.5,"it is a movie that adds to the original movie from 1922. however, some points stands: 1.there are too many sexual scene and teases and does add little to nothing to the movie. 2.runtime can be shortened with so much unecessary scenes; people walking and transpiring? 3.motif? coherence? mad scientist? all of stereotypes of movies are present.  i expect better story telling after a 100 years. you should not just add more scenes and details, but also give meaning to them."
No Name,1.0,"absolute garbage!! i fell asleep, bad acting, bad story i even started laughing a few times. i can not understand the hype for this movie the original 1922 version was ten times better! what a waste of money!!"
Sukhmani  C,4.0,"gore, jump scares, very intriguing and a unique plot. so worth the watch, enjoy!!"
No Name,1.0,worst movie i have seen in a long time. extremely boring. nothing like dracula with wynona ryder! i tried to leave but my husband wanted to finish his beer.
Linda L,1.0,"its hard to know where to begin. the acting was terrible. the set decoration was messy and uninteresting. many of the scenes were centrally focused and uninteresting.  it was boring, plodding, and anemic. dont waste your time on this one."
JH,1.0,dreadful. simply dreadful
No Name,3.0,i was expecting more horror it want bad just not my tastes in horror movies
No Name,5.0,perhaps one of the greatest gothic horrors ever put to film.
Michelle,2.0,a remake that shouldnt have been remade
No Name,0.5,this movie left me exhausted. same visuals you’ve seen before. a lot of unnecessary artsy shots and scenes. no character development. it’s just icky. i feel like things were put in for pure shock value. no substance. the acting was bumpy. i landed up leaving early.
David,1.0,very poor remake on bram stokers dracula. don't waste your money like i did.
Richard D,0.5,redundant. so dark you cant see anything. disjointed. terrible film
No Name,0.5,"nosferatu (2024) misses the mark by leaning heavily into shock value. both versions are great at world building and atmosphere but the poorly written script and outdated themes overwhelmed any positives.  movies or scenes that include sexual violence tropes that aren’t necessary, are boring at this point. it’s a tired, cliched tactic and this movie offers no new insight and relies far too much on trying to make the audience uncomfortable then making those scenes relevant.  the necrophilia scene, in my opinion, was a disgusting addition to the story. i understand vampires are the undead and there are many themes of sex and lust within vampire stories but anna wasn’t a vampire - she was just a dead woman. in the room with their two dead children. bleak.  you can’t give consent when you’re being threatened. it’s no longer consent at that point. so for everyone saying ellen consented at the end by saying the words “i consent” - literally he was threatening to kill everyone in the town if she didn’t have sex with him and she decided to sacrifice herself (that doesn’t equal consent).  the film’s pacing drags, the tension never truly builds, and the result is a drawn-out experience doesn’t offer any new insight to an old, over-used trope."
No Name,0.5,"this movie was photographed well but it's boring, overlong and the editing is so disjointed that you'll lose interest. i've seen the other versions of nosferatu and they stand up well over time. you will note that most critics are raving about the cinematography, really ?  its dark for no real purpose. most movies based upon this theme are really like westerns, hero vs villain's, showdowns, carriage chases at midnight or sun up, innocent damsel in distress waiting for dudley do right ! even the old hammer films got it right!  coppola's dracula was one of the  best i ever saw and this movie isn't in the same ball park. frank langella's was the epitome of cool up to that point. save your money the advertisements are fake news ! :-)"
No Name,1.0,one star for the production value. the story is what matters most and without drawing from memories of earlier versions it does not hold up on its own. it has terrible writing and characters we don’t care about. it was actually stupid. it makes coppola’s look like even more of a masterpiece.
Stef,4.0,i liked dracula better.
Dennis L,5.0,loved it great shooting and atmosphere. dep was amazing olocks look was way different then i thought is would be
Cara,3.0,"i dozed off twice in this movie.  this movie was not for me.  maybe if i had more knowledge on the subject matter, i would have appreciated this film.  nosferatu was hard to understand and his asthmatic breathing was distracting and unnecessary.   save your money people!   wait until it's streaming online!"
Steve B,5.0,"this movie has an unsettling feeling throughout. its a fresh inspired by but not a copy of dracula.  great production design and makeup. it also has some very intense moments. just when you think the movie is moving a little slow something happens that makes you realize its not slow, its perfectly paced. the rats and what came with them (not spoiling) was a clever backdrop. as a seasoned movie goer its hard to scare me but this movie pulled it off, and its just creepy."
Dylan,3.5,incredible acting… but wtf?
No Name,1.0,the weirdest and most genuinely disturbing movie that i have ever seen in theaters. wouldn’t recommend to my worst enemy.
No Name,1.5,i need therapy after watching this
Preston,2.0,"personally, did not like it.  the acting was weird.  maybe that’s what people were like in the 1800s but it seemed exaggerated.  the plot was weird (just a rotting corpse that drinks blood).  just not my cup of tea.  i’ll stick to sexy vamps with cool powers."
John M,3.0,"good, but a little slow"
E F,4.0,"stunning visuals , costume and set design added both elegance and horror to the story."
No Name,1.0,i was hoping for a sexy vampire movie and this was not that! very cinematic odds all i can say that was positive. i cannot get the last three hours out of my mind quick enough!
PayPal U,2.0,confusing plot and story line. only one jump scare.
Scotty,5.0,"this is an epic masterpiece of gothic horror. as a horror movie buff, this is one of the greatest horror movies i've ever seen. the atmosphere is absolutely chilling,  the camera work is delicious, the acting superb, and the scares are real and consistent throughout. i saw it christmas evening and i couldn't wait to go see it again ....better than i expected it could be...."
Peter R,1.0,did not keep our attention at all.
No Name,0.5,"oof… over acted, character motivation all over the place, and boring. very disappointing. one of the worst movies i’ve seen."
No Name,1.0,it was really slow and melodramatic. if it’s aim was period nostalgia it hit if it’s aim was horror it failed badly…
Josie,3.0,perfect watch for a cold snowy afternoon but any other time mighthave felt more laborious.
George C,2.5,"the ending was very satisfying, but the process of getting there was very boring at times."
carl c,1.5,this movie didn’t have a plot. if it did it was a horrible one
No Name,0.5,"absolutely awful. probably one of the worst films i’ve ever seen. plot was way too long, and hard to follow. movie was boring and i should have left half way through"
No Name,5.0,"as someone who has seen the original, grown up in germany, and has roots in the balkans, i deeply appreciate nosferatu. robert eggers has impressed me once again with his mastery of folklore horror, as well as his respect for and consideration of different cultures and languages across europe. the film stays true to the original, and i am truly grateful that they showed such great appreciation for this classic, rather than altering it to suit modern audiences simply for the sake of it. the actors all did an excellent job portraying their characters, and the scenes, backgrounds, and settings were absolutely stunning."
Scott W,5.0,best rendition of the dracula story ive ever seen. great setting the mood well acted and very entertaining.  not to be missed.
No Name,4.0,absolute must see. i have never seen the original and have been intrigued by the story. anyone thinking that this film is a horror it is not. it is much more.... now to watch the original!!!
Sheena,4.0,"suspenseful, great sets and body costumes."
No Name,5.0,"a beautiful, thought-provoking and scary interpretation of dracula/nosferatu."
Andrew C,4.0,"overall, i loved the tone that we come to expect with an eggers movie. while highly enjoyable, some scenes felt forced. but i love that it felt like an old and new film all at once. acting was impeccable by all those involved."
No Name,5.0,"for the fans of dark romance a must see movie, heartwarming and humoristic. the visuals are on the spot with the audio, tickling and exiting."
No Name,1.0,"walked out after 30 minutes. cross between a bad period drama and a mel brooks parody (which might have been a whole lot better). very dissapointed, only went to see it for bill skarsgard as it was so good."
No Name,5.0,"slow, long, but very haunting and brilliant!"
jtrincon U,2.0,it was a very strange and grotesque version of the original movie
No Name,3.5,"i had high expectations for this one, and was left a little disappointed.  great mood and dreamlike quality to the movie.   it just felt unnecessarily long in the theater, and unnecessary overall.  that's my main issue. was this take on nosferatu really necessary?  did it offer anything new?  my answer is no.  it's good, but nothing special.  i think the script needed a bit of work and more focus."
Andrew,5.0,bill skarsgard from pennywise to count orlok my goodness the talent in that human
No Name,0.5,vampire movie cliche + vampire movie cliche + vampire movie cliche ad nauseum: i tried hard not to laugh out loud so as not to spoil anyone else’s enjoyment. i was not always successful.
No Name,5.0,"it won’t be for everyone, if you expecting some teen horror movie with jump scares this movies isn’t for you. the acting is 10 out of 10 same it goes for the way they decided to film it. brings back memories of old movies but better adapted for today. at the end of its core it’s a dark romance"
No Name,2.5,"good acting, got the message, sometimes beautiful... but boring. halfway throught the movie i just wanted it to end and though some might find ""poetry"" in the ending, to me it was just ""meh""."
Sara M,1.0,the acting was horrendous. the pacing was slow. gore added for shock value that was completely out of place. i almost thought it was a parody. i should have walked out.
craig,4.5,"well done classic…. the mustache threw me, but otherwise a good watch…"
No Name,1.0,"clearly a disappointment, it was a poor version of bram stokers dracula.  sad that some actors signed up for this for just a paycheck."
C.W.,2.0,"the cinematography, sets, and acting were outstanding, making nosferatu worth seeing. however, the movie was hard to follow, and the gratuitous violence was gruesome and distracted from the story. we left the movie feeling disappointed in a film that should have been an excellent remake of a classic that, in our options, missed the mark."
No Name,5.0,"two hours of fan service to gothic horror, classic cinematography and vampire lore. if this is a genre you like, this movie covers all the bases. it even has perfect 1830s costumes. it conveys creeping dread through out the film. the actors also worked hard to create that atmosphere.  best vampire movie in 30 years in my opinion. must see film for gothic horror fans.   if you’re looking for a vampire romance or fast paced horror thriller, this is not that style.  probably not the movie for you."
Demerise,1.0,"it was awful. ended up leaving after an hour. slow plot, difficult to see the film was so dark"
Stephen V,4.0,"great style, strong acting, and a very refreshing approach to a very familiar story. definitely worth seeing on a big screen. the visuals are gorgeous"
No Name,2.0,"nosferatu was more interested in having sex than other thing, they principal characters never fight o even try to fight to the moster, i know that is a super power creature but really nothing ? it okey the movie for me is a 6/10."
No Name,4.0,"the story feels a bit thin, and the end underwhelming, but everything else is top notch. amazing cinematography, great acting, great direction. amazing atmosphere. just wish the story took bigger swings."
John,2.0,unfortunately left the theater feeling disappointed…
Gary,0.5,worst movie i have scene in over a decade. i actually left 1/2 way through it was so bad and i love science fiction.
No Name,4.5,robert eggers makes the case with nosferatu that he may be unrivaled when it comes to auteur horror. the film punctuates the tragedies of its familiar story with a nuanced layer of visceral horror that only eggers is capable of producing. ari aster may be the only other horror director who can come close.
Chloe,2.5,good for people who like older movies. it was a lot to understand and thats not my cuppa.
Louisa,0.5,watching the plot play out was as hard as listening to nails on chalkboard.
No Name,5.0,excellent! i don't miss any vampire or vampire-adjacent movies. i'm a vampire junkie. this one checks all the boxes. the hype you've been hearing is true. pay attention or you'll miss the origin of it all. one of the best movies i've seen.
Christopher David Baum,5.0,im romanian: the movie was (authentic) in every way to our culture and lore.
Julie T,5.0,excellent movie. i love the classic feeling of it.
No Name,1.0,awfully boring. vampire movies made 30 years ago were scarier and had better moments. this was a waste of time
No Name,3.0,takes a while to get going but when willem dafoe turns up it starts to cook
Color,5.0,phenomenal!!!! amazing cinematography
Marissa,3.5,"you know when a movie insists upon itself??? well, i didn’t until i watched this. it’s a great allegory for repressed sa trauma or trauma in general, but the run time could’ve been halved and had the same impact. willem was the best part. “then rave she must!!!”"
No Name,5.0,words will immaculately fall short for this cinematic magnum opus of the entire horror genre!! i bow down to thee- mr. eggers. unparalleled horror era has begun!!
Matthew P,2.5,awesome visuals and acting but the story falls short.
David,3.0,"loved the style, artsy shots, costumes were stellar ! not sure about the execution though. i feel like finale just kind of happened."
Dré,5.0,3rd watch… imax … lilacs everywhere!  the soul is sacred. the shadows will consume in the after hours of the night. admitting that evils do exist within us is the only way to put them at bay-  to be able to exist with them and not become lost because of them.   “you are my affliction.” - count orlok
No Name,5.0,bill skarsgard what an actor.
Caleb,3.0,"this movie succeeded in art direction, excelled in individual performances, but lacked a script that ventured to do anything interesting with its beautiful world and characters. remarkably safe but addled with the pieces of a truly inspired film."
russW121,4.0,"it was a beautiful peace of cinema and story telling, had me on the edge of my seat for a majority of the movie"
