Name,Rating,Review
No Name,5.0,"being a fan of the 1922, 1979, and other interpretations, i viewed nosferatu 2024 hoping that robert eggers would pay appropriate tribute to the story, as well as making this one feel different, and purposeful. what i got was a remake that doesn't try to outdo any of the other films, but pay appropriate tribute to them as well as creating a different experience, one that is eery and technically impressive.  yes, technically it is a gorgeous film, despite it being dreary. it's a world of 1838 before electricity. rooms are dark. crackling fires and candles make up the light. muted colors fill out the palette. camerawork and sound put you in the world of this vampire who can ingrain fear into people. apart from these achievements, the way the story unfolds is risky. it asks the audience to be involved and to understand character motivations (which help if you know the original nosferatu), but also to understand the time setting and how the actors are portraying their characters, which tends to be very theatrical. very much silent film acting.   for many people, it just won't be a film for them. their idea of this film dragging on, is my idea of enjoying the world that was created. their absence of seeing character motivations or visual cues are things that fans of the original movie might understand a bit more. like a silent movie, this sound version still wants the audience to participate with their mind. i will concede that it won't work for everyone, but to me, it was an incredible viewing experience."
Kenton,5.0,the cinematography and settings were fantastic.  the count was truly menacing.  reminds me of the old horror movies that i grew up watching.  much more gory and graphic however.
Azia,2.5,so sexually charged. is that the under lining meaning of nosferatu? kinda turned me off from it.. ha the irony
No Name,2.0,"a slow burn gothic tale with lots of atmosphere.  however, this all feels a little too familiar after great movies, such as bram stoker's dracula.  i definitely found it lacking in the horror suspense department.  if you like gothic period pieces, this might entertain you..  if you are looking for a good fright night, it's a lacking."
No Name,1.0,slow boring over acted and filmed mainly in darkness it’s crippling tedious. every scene is drawn out and overacted. it’s like each actor was told to reenact a school hamlet play. not scary. just tedious. would have been better to just watch one of the old dracula films from the 1940’s. looked the same and probably more scary. absolute waste of money.
No Name,5.0,"stylish, cinematic, horrific. every actor was a pro! lilli was brilliant! they don't make films like this anymore! oscar material."
Mothermayeye,1.0,"i was so utterly let down by this movie.  found myself saying ""why? why? why?"" a lot through out the lengthy film.  dr. robotnik?  faking seizures?  why?  visually stunning?  we left early only to go home and watch interview with a vampire.  kirsten dunst, iconic performance.  i give flowers where they are due and this was a waste of 30."
Jared,4.0,excellent cinematography and a great soundtrack set the dreary mood of this movie. the characters portrayed a sense of dread and despair that was quite convincing as a viewer.
Bryan P,3.0,disjointed. glitches in storyline.
No Name,5.0,"el romance gótico y las historias no estaban en mi entendimiento, y nosferatu me emergió en la historia de amor que se explica de una manera perturbadora y bella. muestra que no siempre el romance es hermoso, puede ser obsesivo y trágico, esta película explica perfectamente esa idea, no es lenta y en el transcurso deja clara cada idea. una máster class de imagen, audio e interpretación."
No Name,4.5,"wow, what a movie! eggers crushes this one and makes the 2h+ time commitment a heck of a ride that's well worth it. the casting choices made sense and the plot/storytelling lured you in right away.  from a technical standpoint - production design, photography, makeup & costume design, this team puts on a breathtaking masterpiece that's both terrifying and stunning to look at.   we can stop making vampire movies, this one's execution would be very difficult to surpass. well done, nosferatu team!"
Vixen,5.0,"absolutely wonderful, perfect amount of jump scares, but more importantly captured a ton of the true elements of the nosferatu"
No Name,0.5,"i anticipated the movie to be a true horror movie, during the movie i found myself as well as other people laughing at certain scenes. despite the vulgar scenes and story lines i am sad to say i rated this movie a 4/10. although the characters were great the story was a miss."
Chris J,2.0,"molasses slow retelling of the original nosferatu. neither engaging or scary... atmospheric, yes. very darkly lit. the count is menacing but not scary. completely anticlimactic end. willem dafoe is a favorite actor but he took me out of the film. his wig was poor and his style of acting necessitates others around him are in the same space. they were not.  just really droll and unnecessary."
No Name,5.0,the best adaptation of nosferatu. cant wait for the 4k extended cut steelbook
No Name,1.0,"it’s a well made movie, but just not good. the dialog is overdone, too many story lines, and just a very very slow movie."
No Name,1.0,"i have to say that i thought it was essentially a re-newed version if bram stoker's film dracula, the similarities are almost too many. i preferred that to this. sorry, not my cup of tea at all. 😒"
Bunnie,4.0,much different filming format than other previous vampire movies but definitely worthy of all the praises it's been receiving.
No Name,4.0,"as a fan of the horror genre, i was pleasantly surprised with this movie take on the beloved origin story. the movie was well-written and the cast was amazing a worthy watch for horror fans."
No Name,5.0,if you like the classic hammer horror films you will love this. if you don’t you probably won’t like it. one of the best horror movies i have seen in a while.
No Name,5.0,"i loved this movie from start to finish, amazing work from everyone that worked in it.  from the effects, the designs of the clothes, the acting to the pacing of the story everything was tailored and curated in the best way! one of the best film i saw in the last year!"
No Name,2.0,bill was average. could have saved heaps by having his brother gustav play the role. so many desperate to talk this movie up for some reason. it's not visually incredible but is an overacting masterpiece if that's your thing. ps depps daughter has weirdly large nipples
Noah B,4.0,visually fantastic. great performances. i thought the writing didnt match the rest but overall such a great movie.
No Name,1.0,do not believe these reviews. this move has no plot no story nothing at all. trash movie prob was the worst move i watched in theaters.
No Name,1.0,second most boring movie i have ever seen. they should provide night vision goggles just to see what's happening. dialogue was beyond terrible. the only redeemable element was costuming. walk don't run.
Karen g,0.5,"so disappointed! put it this way i didn't even finish it. i walked out before it even ended ughhh good thing went on the cheap day. like get on with it i wanted moreeeeeeee, this was just ughhhhhh no no no"
Nicholas,0.5,too long to introduce william dafoe character. the movie was too long to get to point. not a good picture.
Mary,4.0,stunning cinematography. plot a bit slow
No Name,5.0,"hacer una recreación de una joya de culto como nosferatu es un tema de discusión. lo cierto es que la elección de robert eggers como director fue la más correcta porque él conocía la película original y porque si el proyecto hubiese estado a cargo de otro director, el resultado final podría no haber sido tan agradable. cuando werner herzog hizo su versión de nosferatu, copio varias cosas evidentes de la película de murnau, pero también le dio un toque propio y algunas ideas nuevas para que nosferatu (1979) fuera una aceptable recreación del clásico de murnau. con la versión de robert eggers pasa lo mismo, pero llevado a un nivel más alto. aquí eggers no copia al 100% la película original, pero narra la misma historia con un toque propio y cambios que le dan a esta versión un argumento más desarrollado y profundo adentramiento al mismo. como es característico del estilo del director, esta película ofrece una visión bastante sombría y con un ritmo lleno de bastante tensión. al igual que the witch y the lighthouse, la dirección de eggers hace que esta película se sienta como una pesadilla. hay momentos en que la influencia del conde orlock afecta mentalmente a los personajes al punto de que sienten que están atrapados en una pesadilla de la que no pueden despertar. hay momentos en los que parece que la realidad se distorsiona y genera una sensación de tensión en el ambiente. thomas hutter ya se está adentrando en una pesadilla y no es hasta que conoce al conde orlok que comienza a sospechas bastante. en la película de murnau, thomas se mostraba escéptico hasta descubrir lo que orlok era realmente. en la versión de herzog, él ya sospechaba del conde al momento de conocerlo y en esta película pasa eso también, pero con más intensidad. el control que orlok tiene sobre ellen es bastante perturbador y es manifestado como algo similar a una posesión demoniaca. el romanticismo que la película ofrece sobre ellen y orlok parece en parte basarse en lo que coppola hizo con drácula, pero la relación entre ellos en esta película es mucho más oscura. el conde orlok de bill skarsgard es mucho más sombrío y siniestro que su contraparte original. pasa mayor parte del tiempo en las sombras y eso lo hace ver mucho más misterioso y tétrico. el vampiro creado por murnau se basaba más en los strigoi que eran vampiros mucho más horripilantes que un vampiro humano común. en ese momento, le dieron una apariencia más similar a un roedor por su vínculo con la peste bubónica. el conde orlok de esta película sigue el mismo parámetro, pero con un diseño mucho más grotesco y demacrado. aquí orlok es un vampiro más cadavérico y se siente como un auténtico no-muerto que lleva siglos demacrándose. también pudieron dar una breve explicación de cómo orlok se convirtió en un no-muerto. el maquillaje es excelente y pudieron brindar una macabra versión del vampiro nosferatu en su máximo esplendor. el bigote fue sacado de la novela de bram stoker, ya que en ese libro la descripción de drácula incluye un bigote y es un detalle que muy pocas veces se ha usado. aquí logro pegar junto con la vestimenta que pone en evidencia la antigüedad de la criatura. robert eggers logro agregar más desarrollo a los personajes superando lo que murnau y herzog habían hecho. la única diferencia sería orlok que en la versión de herzog es más humano y melancólico. así como herzog ha ofrecido nuevos momentos memorables para sentirse como una película original, robert eggers hace lo mismo. existen muy buenos planos con maravillosa fotografía, estupendo vestuario, buen diseño de producción y el correcto uso de luz y sombra. hay escenas que recuerdan un poco al estilo de tim burton. la película se convierte en una obra gótica con escenas perturbadoras, es bastante poética y aterradora. robert eggers supo renovar este clásico tan querido y hacer una película que está a la altura de la original. al igual que sus predecesoras, esta película está destinada a ser un clásico. nosferatu (2024) es una bella película artística, un cuento gótico que revive el arte del vampirismo en el cine y una digna sucesora de la obra de murnau. una prueba irrefutable de que nosferatu logró seguir perdurando en el tiempo, a pesar de haber pasado 100 años. mi calificación final para esta película es un 10/10."
Louis,5.0,one of the best movies ive seen in years. the acting is fantastic. nosferatus voice is perfection.
No Name,3.0,not enough bats for me
No Name,2.0,boring till the last 3rd of movie. kinda corny.
No Name,5.0,"i imagine many a hollywood veteran director/producer are green with evey towards mr. roger eggers, in the same way hollywood h8s jim cameron.....since egger's films rival many & more of the flopbuster & indeed blockbusters of the 20's  oh & nosferatu is great, it goes without saying. a must-see in the theaters gt me to go back to the movies, i can tell you that. )"
Adam,0.5,not worth the money or time. twilight knock off. expected horror being as the original vampire.  more of a sappy love story… should have streamed instead. save your money
Nichole P,4.0,faired well to the original 1922. just a bit much on the sex and nudity. overall it was great.
No Name,2.0,"i was very disappointed. i found it kind of funny, kind of boring. no chills for me."
Matthew,3.5,definitely the best modern interpretation of the dracula mythos. the first half will have you remembering your first read of dracula. the back half is kind of wonky but we'll shot and acted thru and thru
H Alan R,2.5,interesting but very slow.  didn’t live up to the hype though
No Name,5.0,"i love it, it’s a incredible movie with outstanding cinematography and visuals and score and terrific performances by the entire cast specially by deep and skarsgård and of course the amazing and unique direction by eggers."
Thierry,2.0,not a great version of a well known story with a lack of unexpected turns
Virginia B,1.5,"the screenplay didn’t build the characters enough, because i cared about no one. seemed more focused on demon possession, than vampirism. there were a couple of hopeful moments, but not enough for me to want to recommend it even on streaming."
Andre V,5.0,thank you for this cinematic masterpiece mr eggers !
walla,3.5,"solid cinematography its disgustingly horrifying a bit sexual , a different take on an age old story"
bj,3.5,a little long. too much nudity. amazing cinematic artistry!
No Name,2.0,this director is always a visionary.. but the acting (with exception of nicholas hoult and a few others) is almost to the point of soap opera. i’m a huge fan of “the light house” but this was not worth the watch and length of time.
Garrett,4.0,it was a pretty good remake. it is definitely worth the watch.
No Name,0.5,"huge vampire fan. read everything and watched everything imagineable but my gosh was this movie horrendous. terrible script, jumped around and made zero sense. lily was a very poor actress and bills accent for this movie was all over the place and at times i missed what he was even saying. aaron taylor johnsons acting was the only saving grace for this movie. the scene setting was abysmal how you can have a movie last as long at this one and it be poor at setting scenes is ridiculous, nothing makes you care about any character in this movie. saw a few people leave the cinema at different points which i've never experienced before but came as little surprise. i was glad when it was over."
James B T,5.0,a little bit slow in the middle but great ending  would have liked to see more of nosferatu full gore
Joe,5.0,excellent  .... done right
No Name,1.5,"meh, wait for cable, had high expectations but not delivered."
No Name,2.0,"i thought that was more frighting and scary, but instead it was more awkward, i expected a scary movie not this"
Jeffery,5.0,great atmospheric movie. count orloc is gruesome as ever.
Mary,3.0,same standard dracula story with different names for the characters.
Maria y Juan G,5.0,"just so good, we loved every minute of it"
No Name,3.0,"visually stylish, but a movie you’ll either love or think is severely overrated. if you are not the biggest fan of eggers work, you’ll think the ladder"
No Name,1.0,"the scariest part for me was that it almost bored me to death. and that ending... who came up with that? seriously. can't recommend it. which is really sad because i had high hopes for it. don't get me wrong - i loved the original, liked a lot of the pictures but all in all the story was extremly slow and it was very hard for me to stay awake most of the time.. :-("
No Name,1.5,"super boring. they forgot the plot. copy/paste of bram stoker dracula, which was also boring. nice cinematography. dialog seems contrived, and that’s coming from someone who enjoyed the witch. i think eggers needs to go back to low budget, this felt like an ultra produced nothing burger."
No Name,3.0,poor script. the story jumps around too much for its own good. visually astounding
John,5.0,loved the plot and cinematography best vampire movie i think i’ve ever seen
Alexander S,5.0,"second row imax put me in the movie and it was a great telling of the tale. eggers really delivers a sort of descent that relies on rich sensory experiences and no horror gimmicks.  see this in imax, as close as you can stand, so that the image and sound overwhelm.  when count orlock looms above you, youll understand"
Brianna,5.0,this was a masterpiece had us hooked through the whole thing
No Name,1.0,it's very rare that we walk out of a movie. we weren't the only ones either. with a stellar cast i'd expecting something really good. it was just a poor hammer house of horror type movie. visuals similar to some of those on the dracula movie with val kilmer. shame really as it had potential
No Name,3.0,very stylish and engaging version of the classic dracula story but rather plodding at times.
Alex,4.0,visually stunning in true robert eggers fashion.  stellar acting performances all around.  it was a little longer than it needed to be but an overall great movie.
Ronald,1.0,"poor script, story jumped around to much. to dark i assume to hide the poor stage props. ""dark shadows"" was done better than this movie"
Boyle M,2.5,movie was silly. visually great. just another robert eggers movie.
Jarell W,3.5,"adequate remake of a film from the 1920s. i am a lover of vampire movies, so the bias probably added an extra star. the tone and atmosphere were outstanding, yet the plot was problematic when focusing on the character thomas hutter (nicolas hoult), who seemed to make the worse decisions imaginable. although i guess his idiocy was necessary to drive the plot forward. overall the movie was worth seeing, but isn’t something i will revisit often."
No Name,0.5,terrible watch. needs to be rated at least ma15+ for the gore. while the visuals and effects were great they were not met with an ounce of storyline.
No Name,4.5,this movie is simply amazing
No Name,4.0,pretty swag. vampire looks hella gnarly.
Jasaire,5.0,"wowsers!!! this is in no way like the 1920s version. i love the creativity of the story, realistic graphics and make up. in my opinion, i think this movie is great for halloween, a spooky valentine's day or any day of the year. i will definitely see this movie again."
No Name,3.5,"another dracula movie? pshaw..... nevermind! upon watching i was actually pleasantly surprised.  this is the only major adaptation that actually does a halfway decent job at recreating the novel. major props for the sets and atmosphere, takes itself a little too seriously in the acting department sometimes but has a satisfying runtime and resolution. i enjoyed dafoe a lot in this."
No Name,5.0,"it was a beautiful movie, every scene was magnificent. i truly loved this film"
Itza,5.0,it was a great movie very relaxing to watch and entertaining.  i recommend it 100%
Ben W,4.0,"visually beautiful. story was gripping, although the dracula/vampire story has been told time and time again. good effects, great acting (other than aaron taylor johnson), excellent visuals and cinematography, etc, etc. can be slow at times, but i always appreciate a slow burn."
No Name,3.5,"hauntingly beautiful, and worth it for the visuals alone."
Robyn B,5.0,"amazing cinematography, settings, costumes, and overall creepiness!"
No Name,5.0,"it creeps under your skin. a visually stunning adaptation of 1922 nosferatu that honours the original whilst introducing new layers to it, making it a complex alluring gothic horror masterpiece."
Keishon,5.0,probably one of the best horror films i have ever watched!
slipkid99 L,3.0,i thought the ending was a bit anticlimactic.
No Name,5.0,imax viewing was so intense. im not a scary movie guy but i love films. i did not have any back story other than knowing what a vampire is and i was on edge the whole film. i dont think ill ever watch this again.
No Name,1.0,way too long. boring.
No Name,5.0,"so cinematic and detailed. love the production , little slow but worth watching"
No Name,4.0,"i’ve been a fan of the original silent film ever since they played a 16mm print for us in elementary school, during a rained out recess, and it scared the hell out of me. this film is very true to the original but it also fleshes out the story and characters some more."
Peter,4.0,great movie just not exactly what we expected
No Name,0.5,"we’ve never walked out of a movie before, but we walked out of this one. it was trying to do something but it was just awful. not even willem defoe could save it. the plot is all over the place, so much so that i’m not sure there even is one. the characters give you no reason to care about them whatsoever. didn’t even enjoy the cinematography of it. nosferatu is barely in the damn thing.  long, dull, and just plain bad. i don’t know how they made a famous vampire story boring, but they certainly did."
Masha,1.0,honestly was very boring.
No Name,4.0,well crafted and will definitely be seeing a second time!
Michael,5.0,great movie and time spent with my daughter in a comfortable theatre.
No Name,5.0,a masterpiece. it’s in my top 3 vampire movies.
Jeffrey Lang,5.0,this is one of the most absolutely beautiful things i have ever seen. there was not one frame of the film that didn’t convey the feel and tone of the story.
Greg P,4.0,very scary with impending dread layered throughout. beautifully shot
Jessica,3.5,great movie. i just know a lot of people wouldnt be able to understand it. its filled with social commentary but at the heart is a love story and a womans struggle to feel whole. fantastic acting- the director is incredible.
Kevin K,5.0,"a perfect film in every way. i wish all movies were made this well, with this level of cinematography, acting, and writing."
No Name,4.0,"robert eggers gives us one of the best cinematic horror atmospheres we've seen in a long time  this may not be the definitive version we'll see of nosferatu, but it is the most exciting so far. this is due to robert eggers' signature gothic style and his way of telling the story, with the notion that the vampire is a terrible and terrifying being, without any other characteristic that differentiates him.  this ancient vampire continues to be terrifying, firstly because its director does not romanticize the character, but rather gives him that disturbing and chilling air, and secondly because eggers truly understands that nosferatu does not focus on the supernatural terror of an everlasting creature, but on power. impeccable, malicious, immaculate and destructive power. a film with incredible work (especially its photography), cinematically it is full of references and amazing details.  robert eggers adds a new treasure to his outstanding filmography."
brian h,4.0,"great film, beautifully haunting visuals, touched on so many emotions."
No Name,3.5,i enjoyed this even though it was in the main a retelling of “bram stoker’s dracula” with keanu reeves & gary oldman.
No Name,0.5,"the only thing i liked was the atmosphere and filming quality and  movement of the camera.   it was showing the nosferatu toooooo much, he was speaking none stop,the way he was breathing sometimes became like comedy movies. for us it was more comedy than horror ."
Dante,5.0,the best bram stoker adaptation to date! bravo!
James,1.5,"boring, hard to understand some characters, too dark."
No Name,4.5,visually stunning. glad i saw it in theaters
No Name,0.5,i hated this movie. cannot recommend it to anyone. it’s advertised as a horror movie but there is nothing remotely scary about this except maybe the oversexualisation of the women in this movie. honestly this felt more like a porn film than a horror movie. i see what they were trying to do with the creepy and sensual vibes but they just did not execute it well at all. everytime something happens to the female characters in this movie their breasts are out and instead of screaming in pain they’re moaning in a sensual manner. i have a lot more to say about this movie it was just so bad. however if you go into watching this thinking of it as a comedy it might be a little more bearable to watch.
Thomas,4.5,great special effects
No Name,5.0,"one of the best horror movies of all time... not just that , it's a brilliantly made movie... the language is a little tough to understand but otherwise everything is captivating. a must watch!"
No Name,3.0,"the visuals and cinematography are very good.  the acting from the cast is all very good apart from emma corrin who i thought gave a sub par performance, i don't think she was correctly cast for her role.  i found myself expecting more from the film.  slightly disappointed but still enjoyed watching it - with the visuals still staying with me the next day."
Kenneth D,4.5,feels like the definitive dracula movie (with respect to gary oldman). eggers was the perfect director to bring the book and original movie back to life
Sandra,5.0,visually stunning with odes to the 1920s version.
Prayash,5.0,"the movie was really scary, and it was one of those scary movies where you wanna get up and leave while its happening, and then afterwards youre like woah that was so good!"
Lisa B,5.0,"dark gritty, true horror film"
No Name,4.0,very nice movie.....!!!!
